{"schema":"marionet.clip/v0","signDescId":"ase/asllex/start","language":"ase","source":"authored","vrmHumanoid":"vrm1","duration":1.21,"bones":{"rightShoulder":[[0,[0,0,0]],[0.4,[0.05,0.14,0.08]],[0.5,[0.05,0.14,0.08]],[0.76,[0.05,0.14,0.08]],[1.21,[0.05,0.14,0.08]]],"rightUpperArm":[[0,[0,0,0]],[0.4,[-0.248,0.08,-0.264]],[0.5,[-0.248,0.08,-0.264]],[0.76,[-0.248,0.08,-0.264]],[1.21,[-0.248,0.08,-0.264]]],"rightLowerArm":[[0,[0,0,0]],[0.4,[0.2,1.815,0.1]],[0.5,[0.2,1.815,0.1]],[0.76,[0.2,1.815,0.1]],[1.21,[0.2,1.815,0.1]]],"rightHand":[[0,[0,0,0]],[0.4,[1.08,0.127,0.452]],[0.5,[1.08,0.127,0.452]],[0.76,[0.282,0.128,0.453]],[1.21,[0.282,0.128,0.453]]],"rightIndexProximal":[[0,[0,0,0]],[0.4,[0,0,0]],[0.5,[0,0,0]],[0.76,[0,0,0]],[1.21,[0,0,0]]],"rightIndexIntermediate":[[0,[0,0,0]],[0.4,[0,0,0]],[0.5,[0,0,0]],[0.76,[0,0,0]],[1.21,[0,0,0]]],"rightIndexDistal":[[0,[0,0,0]],[0.4,[0,0,0]],[0.5,[0,0,0]],[0.76,[0,0,0]],[1.21,[0,0,0]]],"rightMiddleProximal":[[0,[0,0,0]],[0.4,[0,0,1.38]],[0.5,[0,0,1.38]],[0.76,[0,0,1.38]],[1.21,[0,0,1.38]]],"rightMiddleIntermediate":[[0,[0,0,0]],[0.4,[0,0,1.449]],[0.5,[0,0,1.449]],[0.76,[0,0,1.449]],[1.21,[0,0,1.449]]],"rightMiddleDistal":[[0,[0,0,0]],[0.4,[0,0,1.2144]],[0.5,[0,0,1.2144]],[0.76,[0,0,1.2144]],[1.21,[0,0,1.2144]]],"rightRingProximal":[[0,[0,0,0]],[0.4,[0,0,1.38]],[0.5,[0,0,1.38]],[0.76,[0,0,1.38]],[1.21,[0,0,1.38]]],"rightRingIntermediate":[[0,[0,0,0]],[0.4,[0,0,1.449]],[0.5,[0,0,1.449]],[0.76,[0,0,1.449]],[1.21,[0,0,1.449]]],"rightRingDistal":[[0,[0,0,0]],[0.4,[0,0,1.2144]],[0.5,[0,0,1.2144]],[0.76,[0,0,1.2144]],[1.21,[0,0,1.2144]]],"rightLittleProximal":[[0,[0,0,0]],[0.4,[0,0,1.38]],[0.5,[0,0,1.38]],[0.76,[0,0,1.38]],[1.21,[0,0,1.38]]],"rightLittleIntermediate":[[0,[0,0,0]],[0.4,[0,0,1.449]],[0.5,[0,0,1.449]],[0.76,[0,0,1.449]],[1.21,[0,0,1.449]]],"rightLittleDistal":[[0,[0,0,0]],[0.4,[0,0,1.2144]],[0.5,[0,0,1.2144]],[0.76,[0,0,1.2144]],[1.21,[0,0,1.2144]]],"rightThumbMetacarpal":[[0,[0,0,0]],[0.4,[0.674,-0.294,0.129]],[0.5,[0.674,-0.294,0.129]],[0.76,[0.674,-0.294,0.129]],[1.21,[0.674,-0.294,0.129]]],"rightThumbProximal":[[0,[0,0,0]],[0.4,[0.868,0,0.543]],[0.5,[0.868,0,0.543]],[0.76,[0.868,0,0.543]],[1.21,[0.868,0,0.543]]],"rightThumbDistal":[[0,[0,0,0]],[0.4,[0.555,0,0.494]],[0.5,[0.555,0,0.494]],[0.76,[0.555,0,0.494]],[1.21,[0.555,0,0.494]]],"leftShoulder":[[0,[0,0,0]],[0.4,[0.06,-0.12,-0.08]],[0.5,[0.06,-0.12,-0.08]],[0.76,[0.06,-0.12,-0.08]],[1.21,[0.06,-0.12,-0.08]]],"leftUpperArm":[[0,[0,0,0]],[0.4,[-0.412,-0.074,0.218]],[0.5,[-0.412,-0.074,0.218]],[0.76,[-0.412,-0.074,0.218]],[1.21,[-0.412,-0.074,0.218]]],"leftLowerArm":[[0,[0,0,0]],[0.4,[0.15,-1.438,-0.1]],[0.5,[0.15,-1.438,-0.1]],[0.76,[0.15,-1.438,-0.1]],[1.21,[0.15,-1.438,-0.1]]],"leftHand":[[0,[0,0,0]],[0.4,[-0.381,0.218,0.267]],[0.5,[-0.381,0.218,0.267]],[0.76,[-0.381,0.218,0.267]],[1.21,[-0.381,0.218,0.267]]],"leftIndexProximal":[[0,[0,0,0]],[0.4,[0,0.016,0]],[0.5,[0,0.016,0]],[0.76,[0,0.016,0]],[1.21,[0,0.016,0]]],"leftIndexIntermediate":[[0,[0,0,0]],[0.4,[0,0,0]],[0.5,[0,0,0]],[0.76,[0,0,0]],[1.21,[0,0,0]]],"leftIndexDistal":[[0,[0,0,0]],[0.4,[0,0,0]],[0.5,[0,0,0]],[0.76,[0,0,0]],[1.21,[0,0,0]]],"leftMiddleProximal":[[0,[0,0,0]],[0.4,[0,0,0]],[0.5,[0,0,0]],[0.76,[0,0,0]],[1.21,[0,0,0]]],"leftMiddleIntermediate":[[0,[0,0,0]],[0.4,[0,0,0]],[0.5,[0,0,0]],[0.76,[0,0,0]],[1.21,[0,0,0]]],"leftMiddleDistal":[[0,[0,0,0]],[0.4,[0,0,0]],[0.5,[0,0,0]],[0.76,[0,0,0]],[1.21,[0,0,0]]],"leftRingProximal":[[0,[0,0,0]],[0.4,[0,-0.0056,0]],[0.5,[0,-0.0056,0]],[0.76,[0,-0.0056,0]],[1.21,[0,-0.0056,0]]],"leftRingIntermediate":[[0,[0,0,0]],[0.4,[0,0,0]],[0.5,[0,0,0]],[0.76,[0,0,0]],[1.21,[0,0,0]]],"leftRingDistal":[[0,[0,0,0]],[0.4,[0,0,0]],[0.5,[0,0,0]],[0.76,[0,0,0]],[1.21,[0,0,0]]],"leftLittleProximal":[[0,[0,0,0]],[0.4,[0,-0.0136,0]],[0.5,[0,-0.0136,0]],[0.76,[0,-0.0136,0]],[1.21,[0,-0.0136,0]]],"leftLittleIntermediate":[[0,[0,0,0]],[0.4,[0,0,0]],[0.5,[0,0,0]],[0.76,[0,0,0]],[1.21,[0,0,0]]],"leftLittleDistal":[[0,[0,0,0]],[0.4,[0,0,0]],[0.5,[0,0,0]],[0.76,[0,0,0]],[1.21,[0,0,0]]],"leftThumbMetacarpal":[[0,[0,0,0]],[0.4,[0.0204,-0.081,-0.385]],[0.5,[0.0204,-0.081,-0.385]],[0.76,[0.0204,-0.081,-0.385]],[1.21,[0.0204,-0.081,-0.385]]],"leftThumbProximal":[[0,[0,0,0]],[0.4,[0.0578,0,0]],[0.5,[0.0578,0,0]],[0.76,[0.0578,0,0]],[1.21,[0.0578,0,0]]],"leftThumbDistal":[[0,[0,0,0]],[0.4,[0.0306,0,0]],[0.5,[0.0306,0,0]],[0.76,[0.0306,0,0]],[1.21,[0.0306,0,0]]]},"expressions":{}}
