{"schema":"marionet.clip/v0","signDescId":"ase/asllex/kiss-fist","language":"ase","source":"authored","vrmHumanoid":"vrm1","duration":1.83,"bones":{"rightShoulder":[[0,[0,0,0]],[0.4,[0.1,0.1,0.1]],[0.5,[0.1,0.1,0.1]],[0.63,[0.1,0.1,0.1]],[0.76,[0.1,0.1,0.1]],[0.98,[0.1,0.1,0.1]],[1.18,[0.1,0.1,0.1]],[1.38,[0.1,0.1,0.1]],[1.83,[0.1,0.1,0.1]]],"rightUpperArm":[[0,[0,0,0]],[0.4,[-0.628,0.27,0.214]],[0.5,[-0.628,0.27,0.214]],[0.63,[-0.628,0.27,0.214]],[0.76,[-0.594,0.339,0.238]],[0.98,[-0.594,0.339,0.238]],[1.18,[-0.75,0.227,0.259]],[1.38,[-0.7,0.169,0.204]],[1.83,[-0.7,0.169,0.204]]],"rightLowerArm":[[0,[0,0,0]],[0.4,[0.14,2.267,0.12]],[0.5,[0.14,2.267,0.12]],[0.63,[0.14,2.267,0.12]],[0.76,[0.14,2.365,0.12]],[0.98,[0.14,2.365,0.12]],[1.18,[0.14,2.212,0.12]],[1.38,[0.14,2.07,0.12]],[1.83,[0.14,2.07,0.12]]],"rightHand":[[0,[0,0,0]],[0.4,[-1.094,0.206,0.368]],[0.5,[-1.094,0.206,0.368]],[0.63,[-1.094,0.206,0.368]],[0.76,[-1.019,0.189,0.298]],[0.98,[-1.019,0.189,0.298]],[1.18,[-1.11,0.161,0.317]],[1.38,[-1.186,0.208,0.506]],[1.83,[-1.186,0.208,0.506]]],"rightIndexProximal":[[0,[0,0,0]],[0.4,[0,0,1.38]],[0.5,[0,0,1.38]],[0.63,[0,0,1.38]],[0.76,[0,0,1.38]],[0.98,[0,0,1.38]],[1.18,[0,0,1.38]],[1.38,[0,0,1.38]],[1.83,[0,0,1.38]]],"rightIndexIntermediate":[[0,[0,0,0]],[0.4,[0,0,1.449]],[0.5,[0,0,1.449]],[0.63,[0,0,1.449]],[0.76,[0,0,1.449]],[0.98,[0,0,1.449]],[1.18,[0,0,1.449]],[1.38,[0,0,1.449]],[1.83,[0,0,1.449]]],"rightIndexDistal":[[0,[0,0,0]],[0.4,[0,0,1.2144]],[0.5,[0,0,1.2144]],[0.63,[0,0,1.2144]],[0.76,[0,0,1.2144]],[0.98,[0,0,1.2144]],[1.18,[0,0,1.2144]],[1.38,[0,0,1.2144]],[1.83,[0,0,1.2144]]],"rightMiddleProximal":[[0,[0,0,0]],[0.4,[0,0,1.38]],[0.5,[0,0,1.38]],[0.63,[0,0,1.38]],[0.76,[0,0,1.38]],[0.98,[0,0,1.38]],[1.18,[0,0,1.38]],[1.38,[0,0,1.38]],[1.83,[0,0,1.38]]],"rightMiddleIntermediate":[[0,[0,0,0]],[0.4,[0,0,1.449]],[0.5,[0,0,1.449]],[0.63,[0,0,1.449]],[0.76,[0,0,1.449]],[0.98,[0,0,1.449]],[1.18,[0,0,1.449]],[1.38,[0,0,1.449]],[1.83,[0,0,1.449]]],"rightMiddleDistal":[[0,[0,0,0]],[0.4,[0,0,1.2144]],[0.5,[0,0,1.2144]],[0.63,[0,0,1.2144]],[0.76,[0,0,1.2144]],[0.98,[0,0,1.2144]],[1.18,[0,0,1.2144]],[1.38,[0,0,1.2144]],[1.83,[0,0,1.2144]]],"rightRingProximal":[[0,[0,0,0]],[0.4,[0,0,1.38]],[0.5,[0,0,1.38]],[0.63,[0,0,1.38]],[0.76,[0,0,1.38]],[0.98,[0,0,1.38]],[1.18,[0,0,1.38]],[1.38,[0,0,1.38]],[1.83,[0,0,1.38]]],"rightRingIntermediate":[[0,[0,0,0]],[0.4,[0,0,1.449]],[0.5,[0,0,1.449]],[0.63,[0,0,1.449]],[0.76,[0,0,1.449]],[0.98,[0,0,1.449]],[1.18,[0,0,1.449]],[1.38,[0,0,1.449]],[1.83,[0,0,1.449]]],"rightRingDistal":[[0,[0,0,0]],[0.4,[0,0,1.2144]],[0.5,[0,0,1.2144]],[0.63,[0,0,1.2144]],[0.76,[0,0,1.2144]],[0.98,[0,0,1.2144]],[1.18,[0,0,1.2144]],[1.38,[0,0,1.2144]],[1.83,[0,0,1.2144]]],"rightLittleProximal":[[0,[0,0,0]],[0.4,[0,0,1.38]],[0.5,[0,0,1.38]],[0.63,[0,0,1.38]],[0.76,[0,0,1.38]],[0.98,[0,0,1.38]],[1.18,[0,0,1.38]],[1.38,[0,0,1.38]],[1.83,[0,0,1.38]]],"rightLittleIntermediate":[[0,[0,0,0]],[0.4,[0,0,1.449]],[0.5,[0,0,1.449]],[0.63,[0,0,1.449]],[0.76,[0,0,1.449]],[0.98,[0,0,1.449]],[1.18,[0,0,1.449]],[1.38,[0,0,1.449]],[1.83,[0,0,1.449]]],"rightLittleDistal":[[0,[0,0,0]],[0.4,[0,0,1.2144]],[0.5,[0,0,1.2144]],[0.63,[0,0,1.2144]],[0.76,[0,0,1.2144]],[0.98,[0,0,1.2144]],[1.18,[0,0,1.2144]],[1.38,[0,0,1.2144]],[1.83,[0,0,1.2144]]],"rightThumbMetacarpal":[[0,[0,0,0]],[0.4,[0.632,-0.024,0.049]],[0.5,[0.632,-0.024,0.049]],[0.63,[0.632,-0.024,0.049]],[0.76,[0.632,-0.024,0.049]],[0.98,[0.632,-0.024,0.049]],[1.18,[0.632,-0.024,0.049]],[1.38,[0.632,-0.024,0.049]],[1.83,[0.632,-0.024,0.049]]],"rightThumbProximal":[[0,[0,0,0]],[0.4,[0.963,0,0.659]],[0.5,[0.963,0,0.659]],[0.63,[0.963,0,0.659]],[0.76,[0.963,0,0.659]],[0.98,[0.963,0,0.659]],[1.18,[0.963,0,0.659]],[1.38,[0.963,0,0.659]],[1.83,[0.963,0,0.659]]],"rightThumbDistal":[[0,[0,0,0]],[0.4,[0.53,0,0.495]],[0.5,[0.53,0,0.495]],[0.63,[0.53,0,0.495]],[0.76,[0.53,0,0.495]],[0.98,[0.53,0,0.495]],[1.18,[0.53,0,0.495]],[1.38,[0.53,0,0.495]],[1.83,[0.53,0,0.495]]]},"expressions":{}}
